{
  "$schema": "./production-exceptions.schema.json",
  "schema_version": "macprovider-production-exceptions-v1",
  "updated_at": "2026-09-07T00:00:00Z",
  "updated_by": "ops/retire-stale-production-exceptions",
  "environment": "pearl-production",
  "exceptions": [
    {
      "id": "exc-onboarding-autotune-hello-gate",
      "status": "active",
      "environment": "pearl-production",
      "component": "coordinator",
      "policy_delta": "Pearl may temporarily admit or recover providers while `proof_of_weights.require_autotune_hello_gate` is disabled or relaxed from the strict production expectation that verified in-window hardware/autotune evidence gates admission.",
      "authority_surface": "Pearl coordinator overlay key `proof_of_weights.require_autotune_hello_gate`; coordinator config struct `ProofOfWeightsConfig.RequireAutotuneHelloGate`.",
      "reason": "#582 records the 2026-07-13 onboarding deadlock where verified hardware evidence, trust inventory, catalog, and benchmark gates prevented the Air from joining until the hello gate was temporarily disabled. STABLE-PROMOTION WAIVER 2026-09-07 (#1396): pre-existing prod relaxation, orthogonal to the 1.8.120 BYOM release; still live (require_autotune_hello_gate:false in Pearl overlay); carried blocks_stable_promotion=false with a bounded 2026-12-07T00:00:00Z remediation deadline so a stable 1.8.120 promotion is not held on unrelated fleet-safety work.",
      "owner": "ops/provider-onboarding",
      "issue": "https://github.com/Augustas11/macprovider/issues/582",
      "created_at": "2026-07-13T00:00:00Z",
      "expires_at": "2026-12-07T00:00:00Z",
      "expiry_unknown_reason": "Live Pearl overlay still has proof_of_weights.require_autotune_hello_gate=false (verified 2026-07-22T10:38Z). No finite flip deadline until #582 stranger / no-exception onboarding physical proof lands; do not invent an expiry.",
      "scope": "Pearl production provider onboarding while overlay keeps require_autotune_hello_gate=false; fleet includes known providers mac / augustass-macbook-air / air5 and referral cohort. Must not be read as a global permanent disable outside Pearl production.",
      "removal_condition": "Pearl admits fresh/restored providers through durable hardware-trust approval and strict hello-gate evidence without global gate disabling.",
      "rollback_command": "ssh pearl 'sudo grep -A20 \"^proof_of_weights:\" /opt/macprovider/coordinator.yaml; sudo grep -A20 \"^proof_of_weights:\" /etc/macprovider/coordinator.pearl-overlays.yaml'; then restore the reviewed overlay value with `require_autotune_hello_gate: true` through the existing coordinator deploy/restart procedure.",
      "post_removal_validation": "Confirm `/poolz` and coordinator logs show the provider admitted with verified in-window autotune evidence and no `autotune_evidence_required` bypass or relaxed hello-gate setting.",
      "blocks_stable_promotion": false,
      "evidence": [
        "https://github.com/Augustas11/macprovider/issues/615",
        "https://github.com/Augustas11/macprovider/issues/582",
        "specs/SPEC-032-proof-of-weights-hello-gate.md",
        "phase4-coordinator/internal/config/config.go",
        "ops/runbooks/pearl-exception-clearance-20260722.md"
      ],
      "partial_progress": [
        "2026-07-22 Pearl read-only: /etc/macprovider/coordinator.pearl-overlays.yaml sets require_autotune_hello_gate: false."
      ],
      "still_blocked_for_clearance": [
        "Flip overlay to require_autotune_hello_gate: true requires reviewed deploy + #582 stranger/fresh onboarding physical PASS without gate bypass."
      ]
    },
    {
      "id": "exc-cli-identity-signature-exemption",
      "status": "removed",
      "environment": "pearl-production",
      "component": "coordinator",
      "policy_delta": "Legacy CLI providers may be admitted through `provider_auth_policy.signature_exempt_until` instead of strict challenge-bound durable admission signatures.",
      "authority_surface": "Postgres table `provider_auth_policy` fields `signature_exempt_until` and `granted_by`; coordinator path `verifyIdentitySignature` generic exemption branch.",
      "reason": "#582/#585 recovery depended on a time-bounded CLI auth-policy exemption while durable CLI-owned admission identity migration and physical reboot/reconnect evidence remained incomplete. CLEARED 2026-09-07 (#1396 promotion): Pearl-verified \u2014 provider_auth_policy has 0 signature-exemption rows (fully cleared); fleet on 1.8.117 with durable admission identities. Removed from active exceptions and tombstoned.",
      "owner": "provider-lifecycle/coordinator-auth",
      "issue": "https://github.com/Augustas11/macprovider/issues/585",
      "created_at": "2026-07-13T00:00:00Z",
      "expires_at": "2026-07-20T09:16:08Z",
      "scope": "Pearl macprovider_stats.provider_auth_policy rows for providers air5, air8gb, augustass-macbook-air, mac, and two app providers; all signature_exempt_until values were already <= now as of 2026-07-22 (latest historical deadline 2026-07-20T09:16:08Z).",
      "removal_condition": "All production providers reconnect after restart/reboot using durable admission signatures, and `provider_auth_policy` contains no unexpired signature exemption rows.",
      "rollback_command": "ssh pearl 'sudo -u postgres psql <DB_NAME> -c \"select provider_id, kind, signature_exempt_until, granted_by from provider_auth_policy where signature_exempt_until is not null order by signature_exempt_until;\"' # placeholder DB name only; do not print secrets.",
      "post_removal_validation": "Coordinator logs show `identityAdmissionSignature`/signature admission, no `provider_auth_policy_exempt_used` events, and both physical Macs buyer-serve without manual DB or Keychain edits.",
      "blocks_stable_promotion": false,
      "evidence": [
        "https://github.com/Augustas11/macprovider/issues/615",
        "https://github.com/Augustas11/macprovider/issues/582",
        "https://github.com/Augustas11/macprovider/issues/585",
        "docs/decision-log.md Entry 142",
        "phase4-coordinator/internal/ws/identity_signature.go",
        "phase4-coordinator/internal/stats/migrations/006_spec_026_identity.up.sql",
        "ops/runbooks/pearl-exception-clearance-20260722.md#cli-identity-signature-exemption"
      ],
      "partial_progress": [
        "2026-07-22 Pearl: unexpired exemption count=0 before mutation; 6 historical expired rows present.",
        "2026-07-22 Pearl: UPDATE cleared signature_exempt_until to NULL for those 6 rows; remaining_exempt=0.",
        "2026-07-22 Pearl: 48h coordinator journal count of provider_auth_policy_exempt_used=0."
      ]
    },
    {
      "id": "exc-tokenless-recovery",
      "status": "active",
      "environment": "pearl-production",
      "component": "coordinator",
      "policy_delta": "Recovery may mint or restore provider access without the ordinary restart-safe token path after Malibu/Keychain/import left a launchd provider bearerless.",
      "authority_surface": "Coordinator bootstrap/recovery token paths and operator recovery commands; no bearer or secret values are stored in this register.",
      "reason": "#582 records that tokenless recovery was needed to mint a fresh provider token after the running process had stale in-memory token state and the restarted launchd provider had no usable token. STABLE-PROMOTION WAIVER 2026-09-07 (#1396): pre-existing prod relaxation, orthogonal to the 1.8.120 BYOM release; still live (allow_tokenless_provisional_bootstrap:true in live coordinator.yaml (recovery usage=0)); carried blocks_stable_promotion=false with a bounded 2026-12-07T00:00:00Z remediation deadline so a stable 1.8.120 promotion is not held on unrelated fleet-safety work.",
      "owner": "provider-lifecycle/coordinator-auth",
      "issue": "https://github.com/Augustas11/macprovider/issues/582",
      "created_at": "2026-07-13T00:00:00Z",
      "expires_at": "2026-12-07T00:00:00Z",
      "expiry_unknown_reason": "No active admission_identity_recovery_authorizations on Pearl (count=0 at 2026-07-22). Base coordinator.yaml still has auth.allow_tokenless_provisional_bootstrap=true; treat that config surface as the remaining exception until a reviewed flip + restart-safe custody proof.",
      "scope": "Pearl legacy provider recovery for affected provider IDs; exact live rows/authorizations require read-only Pearl verification.",
      "removal_condition": "Provider credential custody is restart-safe and no tokenless/manual recovery path is needed for fresh install, import, restart, logout/login, or reboot.",
      "rollback_command": "Use only the reviewed recovery command's dry-run/status mode for the specific provider ID; revoke or let expire recovery authorization through the coordinator's documented operator path before enforcing ordinary token custody.",
      "post_removal_validation": "A restarted launchd provider authenticates without GUI prompts or tokenless recovery; coordinator audit logs show no recovery-token fallback for the validation window.",
      "blocks_stable_promotion": false,
      "evidence": [
        "https://github.com/Augustas11/macprovider/issues/615",
        "https://github.com/Augustas11/macprovider/issues/582",
        "https://github.com/Augustas11/macprovider/issues/585",
        "docs/decision-log.md Entry 142",
        "ops/runbooks/pearl-exception-clearance-20260722.md#tokenless-recovery"
      ],
      "partial_progress": [
        "2026-07-22 Pearl: admission_identity_recovery_authorizations=0; recovery audit=0.",
        "2026-07-22 Pearl: auth.require_provider_tokens=true; allow_tokenless_provisional_bootstrap=true in live coordinator.yaml."
      ],
      "still_blocked_for_clearance": [
        "Reviewed config flip of allow_tokenless_provisional_bootstrap to false plus restart-safe token custody physical proof."
      ]
    },
    {
      "id": "exc-tier2-hash-mismatch-containment",